{
  "version": "evidence_bundle.v1",
  "run_id": null,
  "retrieval_run_ids": [
    "b4340592-9636-41ed-a68c-bc1684bb1345",
    "4c704bb7-6183-4b9c-b084-37d1e73ec80e",
    "3a5c3e36-3bb7-4472-8dfc-48e71d4e42bb",
    "a91c3226-65ec-4a28-be57-e00dd8cc190b",
    "ed875d94-d55b-4c5c-b62f-252cc0dfb068",
    "40f39a56-16cf-4002-9de5-3bc0ba765865",
    "fe8f3d78-17e3-46a3-8d13-c78b62845484",
    "6eac21c8-238e-467e-b611-255bb501f94c",
    "12f5c9f2-93b1-4334-b6f1-e39a4269db47"
  ],
  "analysis_date": "2026-09-22",
  "embedding_version_id": "3d0aec24-bc92-4797-848a-e4deca4b78b3",
  "token_budget": 6000,
  "tokens_used": 4958,
  "items": [
    {
      "source_id": "198a9062664e:295-603-1:multi_family_dwelling@1",
      "chunk_id": "115fa972-674e-4487-b071-07574ca1c63c",
      "official_url": "https://city.milwaukee.gov/ImageLibrary/Groups/ccClerk/Ordinances/Volume-2/CH295-sub6.pdf",
      "document_title": "Chapter 295 Subchapter 6 — Commercial Districts",
      "document_sha256": "198a9062664ed8499838570152f0111392dd126366a4950b0dd3e28f32362f24",
      "section": "295-603-1",
      "page": 2,
      "printed_page": 812,
      "anchors": [
        {
          "page": 2,
          "bbox": [
            72.19490909090909,
            207.98000000000002,
            562.4885318181819,
            229.8199999999999
          ],
          "row_index_on_page": 7
        }
      ],
      "verbatim_excerpt": "Table 295-603-1. Multi-family dwelling (RESIDENTIAL USES). NS1: Y; NS2: Y; LB1: Y; LB2: Y; LB3: L; RB1: Y; RB2: Y; CS: Y.",
      "status": "active",
      "category": "use",
      "subquestion": "Is a multi-family dwelling allowed in LB1, with retail on the ground floor?",
      "required_context_type": null,
      "selection_reason": "table row cited by a signed-off rule; keyword rank 3; meaning rank 1",
      "rank": 1,
      "footnote_markers": [],
      "token_count": 31
    },
    {
      "source_id": "198a9062664e:295-605-2:height_maximum_ft@1",
      "chunk_id": "deed66ca-27cf-4daf-b09a-ca835e1ba9b4",
      "official_url": "https://city.milwaukee.gov/ImageLibrary/Groups/ccClerk/Ordinances/Volume-2/CH295-sub6.pdf",
      "document_title": "Chapter 295 Subchapter 6 — Commercial Districts",
      "document_sha256": "198a9062664ed8499838570152f0111392dd126366a4950b0dd3e28f32362f24",
      "section": "295-605-2",
      "page": 16,
      "printed_page": 824,
      "anchors": [
        {
          "page": 16,
          "bbox": [
            90.024,
            396.31,
            684.099985,
            409.99
          ],
          "row_index_on_page": 19
        }
      ],
      "verbatim_excerpt": "Table 295-605-2. Height, maximum (ft.) (Secondary Street). NS1: 45; NS2: 60; LB1: 45; LB2: 60; LB3: 75; RB1: 85; RB2: 85; CS: 60.",
      "status": "active",
      "category": "height",
      "subquestion": "maximum and minimum building height in LB1",
      "required_context_type": null,
      "selection_reason": "table row cited by a signed-off rule; keyword rank 12; meaning rank 4",
      "rank": 2,
      "footnote_markers": [],
      "token_count": 33
    },
    {
      "source_id": "198a9062664e:295-605-2:front_setback_maximum_ft_see_s_295_505_2_b@1",
      "chunk_id": "ae23f8e8-344b-4e71-b43b-b9354e0861c3",
      "official_url": "https://city.milwaukee.gov/ImageLibrary/Groups/ccClerk/Ordinances/Volume-2/CH295-sub6.pdf",
      "document_title": "Chapter 295 Subchapter 6 — Commercial Districts",
      "document_sha256": "198a9062664ed8499838570152f0111392dd126366a4950b0dd3e28f32362f24",
      "section": "295-605-2",
      "page": 16,
      "printed_page": 824,
      "anchors": [
        {
          "page": 16,
          "bbox": [
            90.024,
            154.340005,
            684.099985,
            168.01999999999998
          ],
          "row_index_on_page": 5
        }
      ],
      "verbatim_excerpt": "Table 295-605-2. Front setback, maximum (ft.) (see s. 295-505-2-b) (Primary Street). NS1: 50; NS2: average; LB1: 70; LB2: average; LB3: average; RB1: none; RB2: 70; CS: average.",
      "status": "active",
      "category": "setback_front",
      "subquestion": "front setback minimum and maximum in LB1",
      "required_context_type": null,
      "selection_reason": "table row cited by a signed-off rule; keyword rank 7; meaning rank 1",
      "rank": 3,
      "footnote_markers": [],
      "token_count": 45
    },
    {
      "source_id": "198a9062664e:295-605-2:side_setback_minimum_ft@1",
      "chunk_id": "e92fd4a3-6088-4167-976b-2952f08e76bf",
      "official_url": "https://city.milwaukee.gov/ImageLibrary/Groups/ccClerk/Ordinances/Volume-2/CH295-sub6.pdf",
      "document_title": "Chapter 295 Subchapter 6 — Commercial Districts",
      "document_sha256": "198a9062664ed8499838570152f0111392dd126366a4950b0dd3e28f32362f24",
      "section": "295-605-2",
      "page": 16,
      "printed_page": 824,
      "anchors": [
        {
          "page": 16,
          "bbox": [
            90.024,
            237.16999999999996,
            684.099985,
            250.84999999999997
          ],
          "row_index_on_page": 11
        }
      ],
      "verbatim_excerpt": "Table 295-605-2. Side setback, minimum (ft.) (Secondary Street). NS1: none; NS2: none; LB1: none; LB2: none; LB3: none; RB1: none; RB2: none; CS: none.",
      "status": "active",
      "category": "setback_side",
      "subquestion": "side setback in LB1",
      "required_context_type": null,
      "selection_reason": "table row cited by a signed-off rule; keyword rank 6; meaning rank 1",
      "rank": 4,
      "footnote_markers": [],
      "token_count": 38
    },
    {
      "source_id": "198a9062664e:295-605-2:rear_setback_minimum_ft@1",
      "chunk_id": "867d22b0-0e0c-4181-8fc5-279aa92165c9",
      "official_url": "https://city.milwaukee.gov/ImageLibrary/Groups/ccClerk/Ordinances/Volume-2/CH295-sub6.pdf",
      "document_title": "Chapter 295 Subchapter 6 — Commercial Districts",
      "document_sha256": "198a9062664ed8499838570152f0111392dd126366a4950b0dd3e28f32362f24",
      "section": "295-605-2",
      "page": 16,
      "printed_page": 824,
      "anchors": [
        {
          "page": 16,
          "bbox": [
            90.024,
            264.53,
            684.099985,
            278.21
          ],
          "row_index_on_page": 13
        }
      ],
      "verbatim_excerpt": "Table 295-605-2. Rear setback, minimum (ft.) (Secondary Street). NS1: none; NS2: none; LB1: none; LB2: none; LB3: none; RB1: none; RB2: none; CS: none.",
      "status": "active",
      "category": "setback_rear",
      "subquestion": "rear setback in LB1",
      "required_context_type": null,
      "selection_reason": "table row cited by a signed-off rule; keyword rank 2; meaning rank 1",
      "rank": 5,
      "footnote_markers": [],
      "token_count": 38
    },
    {
      "source_id": "198a9062664e:295-605-2:lot_area_per_dwelling_unit_minimum_sq_ft@1",
      "chunk_id": "419d77ac-d7c0-42df-8044-7b1575a72f64",
      "official_url": "https://city.milwaukee.gov/ImageLibrary/Groups/ccClerk/Ordinances/Volume-2/CH295-sub6.pdf",
      "document_title": "Chapter 295 Subchapter 6 — Commercial Districts",
      "document_sha256": "198a9062664ed8499838570152f0111392dd126366a4950b0dd3e28f32362f24",
      "section": "295-605-2",
      "page": 16,
      "printed_page": 824,
      "anchors": [
        {
          "page": 16,
          "bbox": [
            90.024,
            291.89,
            684.099985,
            307.49
          ],
          "row_index_on_page": 15
        }
      ],
      "verbatim_excerpt": "Table 295-605-2. Lot area per dwelling unit, minimum (sq. ft.) (Secondary Street). NS1: 2,400; NS2: 1,200; LB1: 1,200; LB2: 800; LB3: 300; RB1: 1,200; RB2: 800; CS: 1,200.",
      "status": "active",
      "category": "density",
      "subquestion": "lot area per dwelling unit in LB1",
      "required_context_type": null,
      "selection_reason": "table row cited by a signed-off rule; keyword rank 3; meaning rank 1",
      "rank": 6,
      "footnote_markers": [],
      "token_count": 43
    },
    {
      "source_id": "198a9062664e:295-603-2-p-2:1@1",
      "chunk_id": "93941ffa-b17c-4943-b84a-f22c2d2316d2",
      "official_url": "https://city.milwaukee.gov/ImageLibrary/Groups/ccClerk/Ordinances/Volume-2/CH295-sub6.pdf",
      "document_title": "Chapter 295 Subchapter 6 — Commercial Districts",
      "document_sha256": "198a9062664ed8499838570152f0111392dd126366a4950b0dd3e28f32362f24",
      "section": "295-603-2-p-2",
      "page": 9,
      "printed_page": 819,
      "anchors": [
        {
          "page": 9,
          "page_end": 9
        }
      ],
      "verbatim_excerpt": "In the LB1 district, the parking lot shall function in an accessory manner and shall be used exclusively by owners of a different premises that is within 300 feet of the parking lot, or persons parking with the consent of any owner of the premises, and both the parking lot and the premises within 300 feet are under the same ownership. The parking shall serve as required parking or allowed parking that does not exceed the maximum number of parking spaces permitted for the use served, as specified in s. 295-403.",
      "status": "active",
      "category": "parking",
      "subquestion": "minimum off-street parking spaces required for a multi-family dwelling in LB1",
      "required_context_type": null,
      "selection_reason": "keyword rank 2; meaning rank 1",
      "rank": 7,
      "footnote_markers": [],
      "token_count": 129
    },
    {
      "source_id": "198a9062664e:295-601-2:1@1",
      "chunk_id": "970c6da0-8669-4c44-8d2a-8ba49bfc86cb",
      "official_url": "https://city.milwaukee.gov/ImageLibrary/Groups/ccClerk/Ordinances/Volume-2/CH295-sub6.pdf",
      "document_title": "Chapter 295 Subchapter 6 — Commercial Districts",
      "document_sha256": "198a9062664ed8499838570152f0111392dd126366a4950b0dd3e28f32362f24",
      "section": "295-601-2",
      "page": 1,